{
  "$schema": "../schemas/node.schema.json",
  "version": "0.2.0",
  "id": "quality",
  "type": "concept",
  "role": "verb-function",
  "label": {
    "en": "QUALITY",
    "es": "CUALIDAD",
    "pt": "QUALIDADE"
  },
  "description": {
    "en": "Verb-function concept for attributing identity, classification, quality, property or characteristic to a subject, commonly through copular/linking structures.",
    "es": "Concepto de función verbal para atribuir identidad, clasificación, cualidad, propiedad o característica a un sujeto, normalmente mediante estructuras copulativas o de enlace.",
    "pt": "Conceito de função verbal para atribuir identidade, classificação, qualidade, propriedade ou característica a um sujeito, normalmente por meio de estruturas copulativas ou de ligação."
  },
  "relations": [
    {
      "type": "parent",
      "target": "verb-functions"
    },
    {
      "type": "related",
      "target": "sentence-order"
    },
    {
      "type": "related",
      "target": "auxiliaries"
    },
    {
      "type": "related",
      "target": "questions"
    },
    {
      "type": "related",
      "target": "words"
    },
    {
      "type": "related",
      "target": "tools"
    },
    {
      "type": "supports",
      "target": "practice"
    },
    {
      "type": "supports",
      "target": "examples"
    },
    {
      "type": "returns-to",
      "target": "verbs"
    },
    {
      "type": "returns-to",
      "target": "roots"
    }
  ],
  "representations": [
    {
      "type": "visual-index",
      "target": "quality-leaf"
    },
    {
      "type": "smart-slide",
      "target": "quality-introduction"
    },
    {
      "type": "checklist",
      "target": "quality-checklist"
    },
    {
      "type": "exercise",
      "target": "quality-practice"
    },
    {
      "type": "reference",
      "target": "master-quality"
    }
  ],
  "pedagogy": {
    "level": "core",
    "sequence": 0,
    "speechEnabled": true,
    "interactive": true
  },
  "metadata": {
    "status": "prototype",
    "source": "STRUCTURE - KIND OF WORDS Master",
    "notes": "v0.2 distinguishes Quality from State by treating Quality as attribution of identity, classification, property or characteristic. English BE may realize both Quality and State, while Spanish and Portuguese often distribute these meanings across SER and ESTAR; this contrast is pedagogically useful but not a mechanical one-to-one rule."
  }
}
