{
  "$schema": "../schemas/node.schema.json",
  "version": "0.2.0",
  "id": "state",
  "type": "concept",
  "role": "verb-function",
  "label": {
    "en": "STATE",
    "es": "ESTADO",
    "pt": "ESTADO"
  },
  "description": {
    "en": "Verb-function concept for expressing a condition, situation or state in which a subject is found or is presented in context.",
    "es": "Concepto de función verbal para expresar una condición, situación o estado en que se encuentra o se presenta un sujeto en contexto.",
    "pt": "Conceito de função verbal para expressar uma condição, situação ou estado em que o sujeito se encontra ou é apresentado no contexto."
  },
  "relations": [
    {
      "type": "parent",
      "target": "verb-functions"
    },
    {
      "type": "related",
      "target": "quality"
    },
    {
      "type": "related",
      "target": "sentence-order"
    },
    {
      "type": "related",
      "target": "auxiliaries"
    },
    {
      "type": "related",
      "target": "questions"
    },
    {
      "type": "related",
      "target": "timelines"
    },
    {
      "type": "related",
      "target": "words"
    },
    {
      "type": "related",
      "target": "tools"
    },
    {
      "type": "supports",
      "target": "practice"
    },
    {
      "type": "supports",
      "target": "examples"
    },
    {
      "type": "returns-to",
      "target": "verbs"
    },
    {
      "type": "returns-to",
      "target": "roots"
    }
  ],
  "representations": [
    {
      "type": "visual-index",
      "target": "state-leaf"
    },
    {
      "type": "smart-slide",
      "target": "state-introduction"
    },
    {
      "type": "checklist",
      "target": "state-checklist"
    },
    {
      "type": "timeline",
      "target": "state-timeline"
    },
    {
      "type": "exercise",
      "target": "state-practice"
    },
    {
      "type": "reference",
      "target": "master-state"
    }
  ],
  "pedagogy": {
    "level": "core",
    "sequence": 1,
    "speechEnabled": true,
    "interactive": true
  },
  "metadata": {
    "status": "prototype",
    "source": "STRUCTURE - KIND OF WORDS Master",
    "notes": "v0.2 distinguishes State from Quality by treating State as condition or situation in context. English BE may realize both State and Quality; Spanish and Portuguese frequently use ESTAR for contextual states and SER for identity or characteristic, but actual usage depends on lexical meaning, discourse and language-specific conventions."
  }
}
