{
  "$schema": "../schemas/node.schema.json",
  "version": "0.2.0",
  "id": "action",
  "type": "concept",
  "role": "verb-function",
  "label": {
    "en": "ACTION",
    "es": "ACCIÓN",
    "pt": "AÇÃO"
  },
  "description": {
    "en": "Verb-function concept for expressing what a subject does through lexical actions, activities, habits and routines. Action may overlap with Movement when the lexical event itself involves displacement.",
    "es": "Concepto de función verbal para expresar lo que hace un sujeto mediante acciones léxicas, actividades, hábitos y rutinas. Acción puede superponerse con Movimiento cuando el evento léxico implica desplazamiento.",
    "pt": "Conceito de função verbal para expressar o que o sujeito faz por meio de ações lexicais, atividades, hábitos e rotinas. Ação pode sobrepor-se a Movimento quando o próprio evento lexical envolve deslocamento."
  },
  "relations": [
    {
      "type": "parent",
      "target": "verb-functions"
    },
    {
      "type": "related",
      "target": "auxiliaries"
    },
    {
      "type": "related",
      "target": "sentence-order"
    },
    {
      "type": "related",
      "target": "questions"
    },
    {
      "type": "related",
      "target": "timelines"
    },
    {
      "type": "related",
      "target": "words"
    },
    {
      "type": "related",
      "target": "tools"
    },
    {
      "type": "supports",
      "target": "practice"
    },
    {
      "type": "supports",
      "target": "examples"
    },
    {
      "type": "returns-to",
      "target": "verbs"
    },
    {
      "type": "returns-to",
      "target": "roots"
    }
  ],
  "representations": [
    {
      "type": "visual-index",
      "target": "action-leaf"
    },
    {
      "type": "smart-slide",
      "target": "action-introduction"
    },
    {
      "type": "checklist",
      "target": "action-checklist"
    },
    {
      "type": "timeline",
      "target": "action-timeline"
    },
    {
      "type": "exercise",
      "target": "action-practice"
    },
    {
      "type": "conversation",
      "target": "action-conversation"
    },
    {
      "type": "reference",
      "target": "master-action"
    }
  ],
  "pedagogy": {
    "level": "core",
    "sequence": 3,
    "speechEnabled": true,
    "interactive": true
  },
  "metadata": {
    "status": "prototype",
    "source": "STRUCTURE - KIND OF WORDS Master",
    "notes": "v0.2 keeps Action centered on lexical doing: activities, habits and routines. Routine remains an application of Action rather than an independent verb-function. Action may overlap with Movement for verbs such as go, come, walk and run. Tense, aspect, negation, interrogation and modality are grammatical layers that can operate over Action without redefining it."
  }
}
