{
  "$schema": "../schemas/node.schema.json",
  "version": "0.2.0",
  "id": "existence",
  "type": "concept",
  "role": "verb-function",
  "label": {
    "en": "EXISTENCE",
    "es": "EXISTENCIA",
    "pt": "EXISTÊNCIA"
  },
  "description": {
    "en": "Verb-function concept for presenting the existence, presence, availability or occurrence of someone, something or a fact. English commonly uses existential THERE + BE, while Spanish and Portuguese frequently use HAY and HÁ/TEM according to variety and register.",
    "es": "Concepto de función verbal para presentar la existencia, presencia, disponibilidad u ocurrencia de alguien, algo o un hecho. El inglés usa normalmente THERE + BE, mientras que el español y el portugués recurren con frecuencia a HAY y HÁ/TEM según la variedad y el registro.",
    "pt": "Conceito de função verbal para apresentar a existência, presença, disponibilidade ou ocorrência de alguém, algo ou um fato. O inglês usa com frequência THERE + BE, enquanto espanhol e português recorrem frequentemente a HAY e HÁ/TEM conforme variedade e registro."
  },
  "relations": [
    {
      "type": "parent",
      "target": "verb-functions"
    },
    {
      "type": "related",
      "target": "auxiliaries"
    },
    {
      "type": "related",
      "target": "sentence-order"
    },
    {
      "type": "related",
      "target": "questions"
    },
    {
      "type": "related",
      "target": "timelines"
    },
    {
      "type": "related",
      "target": "words"
    },
    {
      "type": "related",
      "target": "tools"
    },
    {
      "type": "supports",
      "target": "practice"
    },
    {
      "type": "supports",
      "target": "examples"
    },
    {
      "type": "returns-to",
      "target": "verbs"
    },
    {
      "type": "returns-to",
      "target": "roots"
    }
  ],
  "representations": [
    {
      "type": "visual-index",
      "target": "existence-leaf"
    },
    {
      "type": "smart-slide",
      "target": "existence-introduction"
    },
    {
      "type": "checklist",
      "target": "existence-checklist"
    },
    {
      "type": "timeline",
      "target": "existence-timeline"
    },
    {
      "type": "exercise",
      "target": "existence-practice"
    },
    {
      "type": "conversation",
      "target": "existence-conversation"
    },
    {
      "type": "reference",
      "target": "master-existence"
    }
  ],
  "pedagogy": {
    "level": "core",
    "sequence": 4,
    "speechEnabled": true,
    "interactive": true
  },
  "metadata": {
    "status": "prototype",
    "source": "STRUCTURE - KIND OF WORDS Master",
    "notes": "v0.2 distinguishes the semantic function Existence from any single surface form. THERE + BE is a central English construction, HAY is central in Spanish, and Portuguese commonly uses HÁ in formal-neutral registers while TER is widespread in Brazilian speech. Time, negation, interrogation and modality can operate over existential constructions without changing the core existence function."
  }
}
