{
  "$schema": "../schemas/node.schema.json",
  "version": "0.2.0",
  "id": "movement",
  "type": "concept",
  "role": "verb-function",
  "label": {
    "en": "MOVEMENT",
    "es": "MOVIMIENTO",
    "pt": "MOVIMENTO"
  },
  "description": {
    "en": "MASTER VIP teaching function: action in progress, introduced through TO BE + VERB-ING, especially activity simultaneous with speaking. Physical displacement is a related complementary interpretation, not a replacement for the original classification.",
    "es": "Función didáctica original de Master VIP: acción en desarrollo, introducida mediante TO BE + VERB-ING, especialmente simultánea al habla. El desplazamiento físico es una interpretación complementaria relacionada, no una sustitución de la clasificación original.",
    "pt": "Função didática original da Master VIP: ação em desenvolvimento, apresentada por TO BE + VERB-ING, especialmente simultânea à fala. O deslocamento físico é uma interpretação complementar relacionada, não substitui a classificação original."
  },
  "relations": [
    {
      "type": "parent",
      "target": "verb-functions"
    },
    {
      "type": "related",
      "target": "prepositions"
    },
    {
      "type": "related",
      "target": "sentence-order"
    },
    {
      "type": "related",
      "target": "auxiliaries"
    },
    {
      "type": "related",
      "target": "questions"
    },
    {
      "type": "related",
      "target": "timelines"
    },
    {
      "type": "related",
      "target": "words"
    },
    {
      "type": "related",
      "target": "tools"
    },
    {
      "type": "supports",
      "target": "practice"
    },
    {
      "type": "supports",
      "target": "examples"
    },
    {
      "type": "returns-to",
      "target": "verbs"
    },
    {
      "type": "returns-to",
      "target": "roots"
    }
  ],
  "representations": [
    {
      "type": "visual-index",
      "target": "movement-leaf"
    },
    {
      "type": "smart-slide",
      "target": "movement-introduction"
    },
    {
      "type": "checklist",
      "target": "movement-checklist"
    },
    {
      "type": "timeline",
      "target": "movement-timeline"
    },
    {
      "type": "exercise",
      "target": "movement-practice"
    },
    {
      "type": "conversation",
      "target": "movement-conversation"
    },
    {
      "type": "reference",
      "target": "master-movement"
    }
  ],
  "pedagogy": {
    "level": "core",
    "sequence": 2,
    "speechEnabled": true,
    "interactive": true
  },
  "metadata": {
    "status": "prototype",
    "source": "STRUCTURE - KIND OF WORDS Master",
    "notes": "MASTER_ORIGINAL: MOVEMENT = TO BE + VERB-ING; 'We are eating pizza.' / 'Nós estamos comendo pizza.' (Master VIP p.10 and Movement chapter). COMPLEMENTARY_STUDY: lexical physical displacement with go/walk/run is related, not the original definition. No change to assessment contracts or runtime."
  }
}
